{
  "label": [
    {
      "text": "\n "
    },
    {
      "translate": "widget.wheel.back"
    },
    {
      "text": " \n\n "
    },
    {
      "translate": "widget.wheel.back_description",
      "color": "gray"
    },
    {
      "text": " \n "
    },
    {
      "translate": "widget.wheel.back_description_second",
      "color": "gray"
    },
    {
      "text": " \n"
    }
  ],
  "preview": "minecraft:command_block",
  "take_slot": "bottom",
  "actions": [
    {
      "type": "open",
      "path": ""
    }
  ]
}