{
  "label": [
    {
      "text": "\n "
    },
    {
      "translate": "widget.building.first_pos"
    },
    {
      "text": " \n\n "
    },
    {
      "translate": "widget.building.first_pos_description",
      "color": "gray"
    },
    {
      "text": " \n "
    },
    {
      "translate": "widget.building.first_pos_description_second",
      "color": "gray"
    },
    {
      "text": " \n"
    }
  ],
  "preview": "minecraft:wooden_axe",
  "take_slot": "bottom_left",
  "actions": [
    {
      "type": "command",
      "command": "//pos1"
    }
  ]
}