{
  "label": [
    {
      "text": "\n "
    },
    {
      "translate": "widget.building.second_pos"
    },
    {
      "text": " \n\n "
    },
    {
      "translate": "widget.building.second_pos_description",
      "color": "gray"
    },
    {
      "text": " \n "
    },
    {
      "translate": "widget.building.second_pos_description_second",
      "color": "gray"
    },
    {
      "text": " \n"
    }
  ],
  "preview": "minecraft:stone_axe",
  "take_slot": "bottom_right",
  "actions": [
    {
      "type": "command",
      "command": "//pos2"
    }
  ]
}